{
  "created_paths": [
    "AGENT_SPEC.yaml",
    "ARCHITECTURE.md",
    "COMMANDER_INTENT.md",
    "README.md",
    "WORKFLOW.md",
    "adapters/codex/SKILL.md",
    "adapters/codex/agents/openai.yaml",
    "evaluation/cases.yaml",
    "factory-manifest.json",
    "knowledge/resources.yaml",
    "skills/catalog.yaml",
    "tools/tools.yaml"
  ],
  "file_hashes": {
    "AGENT_SPEC.yaml": "sha256:d128e78a8b2fb9d32286007b0f8441cd93448106e498758a60deac3655e2cef8",
    "ARCHITECTURE.md": "sha256:86c640a9cf1fbc32498cfd3b451e7ccc94f45e323eb235541a290576d13a5d48",
    "COMMANDER_INTENT.md": "sha256:9126fdd8c299af65c3731429902341529d0e5c259fc6357aa31431f15a8ec214",
    "README.md": "sha256:fe84cf7f329c6dfa4f9b7cb0c0f146e9f41f76e5d45aaad9529e39c6e7692027",
    "WORKFLOW.md": "sha256:25e0dea6a3efdada95af44502a252805263613215a2bd412d59ee571e9ee957a",
    "adapters/codex/SKILL.md": "sha256:65ea1d1e41f56a1bf865dd5a3d3252a372dd29baaeabf900d6c73e0d02f5b239",
    "adapters/codex/agents/openai.yaml": "sha256:7708ef127d177292b78e90a1c3de31fde5b862aa4a0796c0375f766e2873d83f",
    "evaluation/cases.yaml": "sha256:227d02831fc7c125177cd9b1bc130a720f43100bf11b59e9d1bf3454062845dd",
    "knowledge/resources.yaml": "sha256:c354e1e200b6b3555d841d48ee4d8a5099320acd41bab40e9d863c90559d95ce",
    "skills/catalog.yaml": "sha256:83add475d781ab55bca5d436e99624cf4f54ce2ae94e87f2fef337580fbde103",
    "tools/tools.yaml": "sha256:e246637e6513d6e24638038d6e54473d6bf36a11a1b25778b488c9f8bfe13770"
  },
  "generator_version": "0.1.0",
  "omitted_components": {
    "deployment": "not_modeled",
    "prompts": "not_modeled"
  },
  "schema_version": "1.0",
  "source_hashes": {
    "agent_blueprint": "sha256:15e276f213fd184ab1b898ab17943cfa3a240bfe3e253920a3d5b33432acc918",
    "commander_intent": "sha256:22abdaef4a6029b4e70e4470ade9abb89657e732566a2144d7a8c8b9064de75a"
  },
  "status_layers": {
    "installed": false,
    "local_generated": true,
    "local_validated": false,
    "published": false,
    "real_usage_verified": false
  },
  "template_set_hash": "sha256:743c818a6dba17784d2256f236cf9c0331a7aff72792b722cb4373c210b0ac52"
}
